therion 6.3.3 (2025-01-06)
  - using Proj 9.5.0, compiled against 9.5.0
initialization file: /usr/local/etc/therion.ini
reading ... done
checking optional fonts csr10 csti10 csbx10 csss10 csssi10 ... OK
checking optional fonts cmcyr10 cmcti10 cmcbx10 cmcss10 cmcssi10 ... OK
configuration file: Pomma.thconfig
reading ... done
reading source files ... done
preprocessing database ... done
scanning centreline tree ... done
searching for centerline loops ... done
calculating station coordinates ... done
processing survey data ... 
####################### cavern log file ########################
 1> Survex 1.4.8
 2> Copyright © 1990-2024 Olly Betts
 3> La topographie n’a pas de points fixes. Par conséquent j’ai fixé 1 à (0,0,0)
 4> 
 5> La topographie contient 35 stations, connectées par 34 visées.
 6> Il y a 0 bouclages.
 7> Longueur totale de la topographie =  120.83m ( 120.83m ajusté)
 8> Longueur totale en projection horizontale =  112.64m
 9> Longueur totale verticale =   35.62m
10> Intervalle vertical = 32.79m (de 35 à 32.79m jusqu’à 2 à 0.00m)
11> Intervalle Nord-Sud = 58.89m (de 1 à 0.00m jusqu’à 35 à -58.89m)
12> Intervalle Est-Ouest = 23.01m (de 22 à 23.01m jusqu’à 1 à 0.00m)
13>    2 1-nœuds.
14>   33 2-nœuds.
15> 
######################### transcription ########################
 3> 1 : Siphon@Pomma.Pomma
 5> 35 : Pomma@Pomma.Pomma -- 34 : 32@Pomma.Pomma
10> 35 : Pomma@Pomma.Pomma -- 2 : 0@Pomma.Pomma
11> 1 : Siphon@Pomma.Pomma -- 35 : Pomma@Pomma.Pomma
12> 22 : 20@Pomma.Pomma -- 1 : Siphon@Pomma.Pomma
13> 2 : 0@Pomma.Pomma
14> 33 : 31@Pomma.Pomma
#################### end of cavern log file ####################
done
calculating basic statistics ... done
processing extended elevation ... done
processing references ... done
selecting export objects ... 
therion: warning -- Pomma.thconfig [304] -- object not found -- "MC-Pomma"
done
processing projection plan ... done
average distortion: 0.01%
writing Data/plan.xvi ... done
processing projection extended ... done
writing Data/coupe.xvi ... done


############### export maps & scraps selection #################
M    17.56 MP-Pomma@Pomma (Pomma)
S    28.75 SP-Pomma-3@Pomma ()
S    18.80 SP-Pomma-2@Pomma ()
S     5.14 SP-Pomma-1@Pomma ()
########## end of export maps & scraps selection ###############
writing Outputs/Pomma-plan.pdf ...
####################### metapost log file ########################
This is MetaPost, version 1.999 (TeX Live 2015) (kpathsea version 6.2.1)  3 MAR 2025 10:50
**data.mp
(/usr/local/texlive/2015/texmf-dist/metapost/base/mpost.mp
(/usr/local/texlive/2015/texmf-dist/metapost/base/plain.mp
Preloading the plain mem file, version 1.005) ) (./data.mp
{randomseed:=42}
 [1] [2] [3] [4]
[5] [6] [7] [8] [9] [10] [11] [12] [13] [14]
[15] [1] [2] [3] [4] [5]
[Warning: scrap outline intersects itself in scrap SP-Pomma-2@Pomma] [6] [7]
[8] [9]
[Warning: scrap outline intersects itself in scrap SP-Pomma-3@Pomma] [10] [11]
[12] (./mptextmp.mp) [13] (./mptextmp.mp) (./mptextmp.mp) (./mptextmp.mp)
(./mptextmp.mp) (./mptextmp.mp) (./mptextmp.mp) [14] (./mptextmp.mp)
(./mptextmp.mp) (./mptextmp.mp) (./mptextmp.mp) (./mptextmp.mp) (./mptextmp.mp)
(./mptextmp.mp) [15] [16] [17] [18] [19] [20] [21] [22] [23] [24] )
 
Here is how much of MetaPost's memory you used:
 4817 strings using 115656 characters
 3759736 bytes of node memory
 1748 symbolic tokens
 10i,81n,19p,449b,5f stack positions out of 16i,96n,20p,487b,6f
39 output files written: data-patt.1 .. data.24


#################### end of metapost log file ####################
converting scraps ... done
making map ... done
######################## pdftex log file #########################
This is pdfTeX, Version 3.14159265-2.6-1.40.16 (TeX Live 2015) (preloaded format=pdftex 2016.5.13)  3 MAR 2025 10:50
entering extended mode
 restricted \write18 enabled.
 %&-line parsing enabled.
**data.tex
(./data.tex (./th_enc.tex) (./th_texts.tex) (./th_resources.tex
(/usr/local/texlive/2015/texmf-dist/tex/generic/pdftex/glyphtounicode.tex))
(./th_fontdef.tex{/usr/local/texlive/2015/texmf-var/fonts/map/pdftex/updmap/pdf
tex.map}<<th_gour_aaaaaaa.dat>><<th_gour_aaaaaab.dat>><<th_gour_aaaaaac.dat>>)
(./th_formdef.tex) (./th_pagedef.tex
Overfull \hbox (5.96262pt too wide) in paragraph at lines 12--12
[]\thfb (c) li-cence CCby-nc-sa : http://creativecommons.org/licenses/by-nc-sa/
4.0/ 2025 |

\hbox(9.0+3.0)x398.33818, glue set - 1.0
.\hbox(0.0+0.0)x0.0
.\thfb (
.\thfb c
.\thfb )
.\glue 4.0 plus 2.0 minus 1.33333
.etc.

(./th_legendcolor.tex)) (./th_pages.tex)
 86 numeric registers used out of 32768
 [1] ) 
Here is how much of TeX's memory you used:
 349 strings out of 494671
 4580 string characters out of 6148971
 33921 words of memory out of 5000000
 1975 multiletter control sequences out of 15000+600000
 22343 words of font info for 69 fonts, out of 8000000 for 9000
 1420 hyphenation exceptions out of 8191
 10i,6n,8p,712b,54s stack positions out of 5000i,500n,10000p,200000b,80000s
</usr/local/texlive/2015/texmf-dist/fonts/type1/public/amsfonts/cm/cmbx10
.pfb></usr/local/texlive/2015/texmf-dist/fonts/type1/public/amsfonts/cm/cmss10.
pfb></usr/local/texlive/2015/texmf-dist/fonts/type1/public/amsfonts/cm/cmssi10.
pfb></usr/local/texlive/2015/texmf-dist/fonts/type1/public/amsfonts/cm/cmti10.p
fb></usr/local/texlive/2015/texmf-dist/fonts/type1/public/cs/csssi10.pfb>
Output written on data.pdf (1 page, 85542 bytes).
PDF statistics:
 129 PDF objects out of 1000 (max. 8388607)
 73 compressed objects within 1 object stream
 0 named destinations out of 1000 (max. 500000)
 307 words of extra memory for PDF output out of 10000 (max. 10000000)


##################### end of pdftex log file #####################
done


############### export maps & scraps selection #################
S     -.-- @ ()
########## end of export maps & scraps selection ###############
writing Outputs/Pomma-coupe.pdf ...
####################### metapost log file ########################
This is MetaPost, version 1.999 (TeX Live 2015) (kpathsea version 6.2.1)  3 MAR 2025 10:50
**data.mp
(/usr/local/texlive/2015/texmf-dist/metapost/base/mpost.mp
(/usr/local/texlive/2015/texmf-dist/metapost/base/plain.mp
Preloading the plain mem file, version 1.005) ) (./data.mp
{randomseed:=42}
 [1] [2] [3] [4]
[5] [6] [7] [8] [9] [10] [11] [12] [13] [14]
[15] [1] [2] (./mptextmp.mp) [3] (./mptextmp.mp) (./mptextmp.mp) (./mptextmp.mp
) (./mptextmp.mp) (./mptextmp.mp) (./mptextmp.mp) [4] )
 
Here is how much of MetaPost's memory you used:
 5266 strings using 151756 characters
 3713584 bytes of node memory
 1742 symbolic tokens
 9i,81n,16p,312b,5f stack positions out of 16i,96n,20p,312b,6f
19 output files written: data-patt.1 .. data-patt.15


#################### end of metapost log file ####################
converting scraps ... done
making map ... done
######################## pdftex log file #########################
This is pdfTeX, Version 3.14159265-2.6-1.40.16 (TeX Live 2015) (preloaded format=pdftex 2016.5.13)  3 MAR 2025 10:50
entering extended mode
 restricted \write18 enabled.
 %&-line parsing enabled.
**data.tex
(./data.tex (./th_enc.tex) (./th_texts.tex) (./th_resources.tex
(/usr/local/texlive/2015/texmf-dist/tex/generic/pdftex/glyphtounicode.tex))
(./th_fontdef.tex{/usr/local/texlive/2015/texmf-var/fonts/map/pdftex/updmap/pdf
tex.map})
(./th_formdef.tex) (./th_pagedef.tex) (./th_pages.tex)
 51 numeric registers used out of 32768
 [1] ) 
Here is how much of TeX's memory you used:
 310 strings out of 494671
 4191 string characters out of 6148971
 52855 words of memory out of 5000000
 1939 multiletter control sequences out of 15000+600000
 21194 words of font info for 66 fonts, out of 8000000 for 9000
 1420 hyphenation exceptions out of 8191
 9i,5n,8p,324b,54s stack positions out of 5000i,500n,10000p,200000b,80000s
</usr/local/texlive/2015/texmf-dist/fonts/type1/public/amsfonts/cm/cmss10
.pfb></usr/local/texlive/2015/texmf-dist/fonts/type1/public/amsfonts/cm/cmssi10
.pfb></usr/local/texlive/2015/texmf-dist/fonts/type1/public/amsfonts/cm/cmti10.
pfb></usr/local/texlive/2015/texmf-dist/fonts/type1/public/cs/csssi10.pfb></usr
/local/texlive/2015/texmf-dist/fonts/type1/public/cs/csti10.pfb>
Output written on data.pdf (1 page, 54232 bytes).
PDF statistics:
 53 PDF objects out of 1000 (max. 8388607)
 32 compressed objects within 1 object stream
 0 named destinations out of 1000 (max. 500000)
 67 words of extra memory for PDF output out of 10000 (max. 10000000)


##################### end of pdftex log file #####################
done
writing Outputs/Pomma.lox ...... done
writing xtherion file ... done
compilation time: 4 sec


###################### scrap distortions #######################
 PROJECTION: plan
 AVERAGE  MAXIMAL  SCRAP
   0.01%    0.12%  SP-Pomma-2@Pomma
   0.00%    0.12%  SP-Pomma-1@Pomma
   0.01%    0.10%  SP-Pomma-3@Pomma
################### end of scrap distortions ###################
